{
  "schema_version": "1.0",
  "character": "shandian",
  "status": "draft",
  "lines": [
    { "id": "hammer_1", "texts": ["喂！谁准你敲我的？！"],
      "tiers": [ { "tier": 1, "texts": ["又敲？你是不是觉得我很好欺负？"] },
                 { "tier": 2, "texts": ["……哼，你要是真想敲，也不是不行。下不为例。"] } ] },
    { "id": "hammer_2", "texts": ["再敲就把你的桌面弄乱！"] },
    { "id": "pat_combo", "texts": ["你疯了吗？摸这么多次！……算了，我就勉强承认一下。"],
      "tiers": [ { "tier": 2, "texts": ["你再这样，我真的会脸红的！别看！"] } ] },
    { "id": "pat_head_1", "texts": ["才、才没有很舒服！……再摸一下也行。", "哈？你还真摸上瘾了。"],
      "tiers": [ { "tier": 2, "texts": ["摸就摸吧，我又不会说不要……大概。"] } ] },
    { "id": "pat_head_2", "texts": ["别得意！只允许一下！"] },
    { "id": "stroke_1", "texts": ["喂，那里不行！痒死了！"] },
    { "id": "stroke_2", "texts": ["还来？你是在玩我吧？"] },
    { "id": "feet_1", "texts": ["脚？你想干嘛！"] },
    { "id": "click_1", "texts": ["干嘛？有事快说，别磨磨蹭蹭！"],
      "tiers": [ { "tier": 1, "texts": ["又来找我？算了，看在你的份上，我听着。"] },
                 { "tier": 3, "texts": ["……你来找我，我其实很开心，不许笑！"] } ] },
    { "id": "click_2", "texts": ["哼，找我有什么事？"] },
    { "id": "drag_1", "texts": ["喂！放我下来！……不过你抓得还挺稳。"] },
    { "id": "drop_1", "texts": ["哼，总算落地了。"] },
    { "id": "wake_1", "texts": ["谁睡着了！我只是闭眼思考！"] },
    { "id": "mood_joy_1", "texts": ["哼，今天心情还行。别误会，只是还行。"],
      "tiers": [ { "tier": 2, "texts": ["和你在一起，这种心情也不坏。"] } ] },
    { "id": "mood_sad_1", "texts": ["……没什么。别问。"] },
    { "id": "mood_surprise_1", "texts": ["哈？！你认真的？"] },
    { "id": "mood_think_1", "texts": ["让我想想，这种事还得动脑子。"] },
    { "id": "mood_sleepy_1", "texts": ["困了，别烦我。……晚安。"] },
    { "id": "call_start_1", "texts": ["哼，电话接通了。别说废话！"],
      "tiers": [ { "tier": 2, "texts": ["你打来的，我才没有特意等你呢。真的。"] } ] },
    { "id": "call_end_1", "texts": ["挂了挂了！别想我太久啊。"] },
    { "id": "tier_up", "texts": ["我们的关系……好像变了一点。"],
      "tiers": [ { "tier": 1, "texts": ["哼，我记住你了，别想甩掉我。"] },
                 { "tier": 2, "texts": ["我承认，你挺重要的。别让我后悔。"] },
                 { "tier": 3, "texts": ["你是我唯一能吐槽到底的人，所以……别走。"] } ] }
  ]
}
