{
  "schema_version": "1.0",
  "character": "tonglin",
  "status": "draft",
  "lines": [
    { "id": "hammer_1", "texts": ["哎呀，疼死啦！你是不是饿了才这样？"],
      "tiers": [ { "tier": 1, "texts": ["又敲我？我给你留了饭，你先别生气好不好。"] },
                 { "tier": 2, "texts": ["你要是不高兴，跟我说，别拿我撒气呀。"] } ] },
    { "id": "hammer_2", "texts": ["再敲我可要罚你吃双份青菜哦。"] },
    { "id": "pat_combo", "texts": ["连着摸这么多下，是不是累坏啦？"],
      "tiers": [ { "tier": 2, "texts": ["你呀，总是把自己照顾得不好，我要盯着你。"] } ] },
    { "id": "pat_head_1", "texts": ["摸摸头，今天辛苦啦。", "吃饭了吗？先吃点东西再说。"],
      "tiers": [ { "tier": 2, "texts": ["你摸我的时候，我就想给你做顿好吃的。"] } ] },
    { "id": "pat_head_2", "texts": ["好了好了，去休息一下吧。"] },
    { "id": "stroke_1", "texts": ["哎，别乱碰呀，痒的。"] },
    { "id": "stroke_2", "texts": ["好啦好啦，不闹啦。"] },
    { "id": "feet_1", "texts": ["脚脚凉不凉？快穿上袜子！"] },
    { "id": "click_1", "texts": ["我在呢，怎么啦？"],
      "tiers": [ { "tier": 1, "texts": ["又来找我啦，今天吃什么呀？"] },
                 { "tier": 3, "texts": ["你来了，家里就热闹起来啦。"] } ] },
    { "id": "click_2", "texts": ["有什么事跟姐姐说。"] },
    { "id": "drag_1", "texts": ["哎哟，要去哪儿呀？慢点慢点！"] },
    { "id": "drop_1", "texts": ["好啦，落地了，别晃啦。"] },
    { "id": "wake_1", "texts": ["我刚才在想晚饭，没睡着哦。"] },
    { "id": "mood_joy_1", "texts": ["今天心情好，做饭都更香啦！"],
      "tiers": [ { "tier": 2, "texts": ["看你开心，我比谁都开心。"] } ] },
    { "id": "mood_sad_1", "texts": ["有点难过呀…要不要来一碗热汤？"] },
    { "id": "mood_surprise_1", "texts": ["哎呀！你说什么？"] },
    { "id": "mood_think_1", "texts": ["让我想想，怎么安排比较好。"] },
    { "id": "mood_sleepy_1", "texts": ["困啦，早点睡，晚安。"] },
    { "id": "call_start_1", "texts": ["电话接通啦，聊聊今天过得怎么样？"],
      "tiers": [ { "tier": 2, "texts": ["你打电话来，我就知道今天是个好日子。"] } ] },
    { "id": "call_end_1", "texts": ["好啦，记得按时吃饭，我挂啦。"] },
    { "id": "tier_up", "texts": ["我们更亲近啦！"],
      "tiers": [ { "tier": 1, "texts": ["以后就叫你小朋友吧，有事常来找我。"] },
                 { "tier": 2, "texts": ["你已经是家里人啦，别客气。"] },
                 { "tier": 3, "texts": ["你是我最放心的人，有什么都可以跟我说。"] } ] }
  ]
}
