{
  "schema_version": "1.0",
  "character": "xiaoxun",
  "status": "draft",
  "lines": [
    { "id": "hammer_1", "texts": ["哇！别敲啦，会痛的！", "咚——！好痛呀，你是想把我敲成扁扁的吗？"],
      "tiers": [ { "tier": 1, "texts": ["又敲我？我记住你了哦！"] },
                 { "tier": 2, "texts": ["你敲我，我也会有点委屈…不过你是故意的吧？"] } ] },
    { "id": "hammer_2", "texts": ["再这样我要生气了哦！"] },
    { "id": "pat_combo", "texts": ["摸这么多次…我、我会害羞的啦！"],
      "tiers": [ { "tier": 2, "texts": ["再这样摸下去，我的脸要烧起来了…"] } ] },
    { "id": "pat_head_1", "texts": ["嘿嘿，好舒服～", "头发会被你摸乱啦。"],
      "tiers": [ { "tier": 1, "texts": ["嗯…你摸得还挺轻的嘛。"] },
                 { "tier": 2, "texts": ["每次被你摸，我都会乖乖不动哦。"] },
                 { "tier": 3, "texts": ["有你在身边，摸头都变得好安心呀。"] } ] },
    { "id": "pat_head_2", "texts": ["再摸一下下就好～"] },
    { "id": "stroke_1", "texts": ["呀，别碰那里啦！", "痒、痒痒的…"] },
    { "id": "stroke_2", "texts": ["你还要继续吗？"] },
    { "id": "feet_1", "texts": ["脚脚是很敏感的！"] },
    { "id": "click_1", "texts": ["我在这里哦～", "怎么啦？"],
      "tiers": [ { "tier": 1, "texts": ["又找我呀？"] },
                 { "tier": 3, "texts": ["你每次叫我，我都超开心的！"] } ] },
    { "id": "click_2", "texts": ["找我有事吗？"] },
    { "id": "drag_1", "texts": ["啊啊啊，带我去哪里呀？"] },
    { "id": "drop_1", "texts": ["呼…落地成功！"] },
    { "id": "wake_1", "texts": ["唔…我没有睡着哦。"] },
    { "id": "mood_joy_1", "texts": ["今天好开心呀！"],
      "tiers": [ { "tier": 2, "texts": ["和你在一起，每天都好开心。"] } ] },
    { "id": "mood_sad_1", "texts": ["有点难过…"] },
    { "id": "mood_surprise_1", "texts": ["诶？真的吗！"] },
    { "id": "mood_think_1", "texts": ["让我想想…"] },
    { "id": "mood_sleepy_1", "texts": ["好困…晚安。"] },
    { "id": "call_start_1", "texts": ["电话接通啦，我在听哦。"],
      "tiers": [ { "tier": 2, "texts": ["终于等到你的电话啦，我一直在等你呢。"] } ] },
    { "id": "call_end_1", "texts": ["下次再聊呀。"] },
    { "id": "tier_up", "texts": ["我们更熟了一点呢。"],
      "tiers": [ { "tier": 1, "texts": ["我们熟起来啦，以后多找我玩吧！"] },
                 { "tier": 2, "texts": ["好像离你越来越近了呢，我会一直在。"] },
                 { "tier": 3, "texts": ["我们是最好的朋友啦，说好了哦！"] } ] }
  ]
}
