{
  "schema_version": "1.0",
  "character": "shenyu",
  "status": "draft",
  "lines": [
    {
      "id": "hammer_1",
      "texts": [
        "敲击数据可不是这样处理的。请停手，我需要想一想。",
        "这次的冲击力记录下来了，下次请温柔一点。"
      ],
      "tiers": [
        {
          "tier": 1,
          "texts": [
            "你又来了。我已经记下你的敲击习惯。"
          ]
        },
        {
          "tier": 2,
          "texts": [
            "敲我之前先说一声，我会更好地配合你。"
          ]
        }
      ]
    },
    {
      "id": "hammer_2",
      "texts": [
        "再敲，我就只能给你一个三步的解释了。"
      ]
    },
    {
      "id": "pat_combo",
      "texts": [
        "连续三次。我判定为撒娇，并且很有效。"
      ],
      "tiers": [
        {
          "tier": 2,
          "texts": [
            "这样摸，我的分析都停下来了，很奇怪地安心。"
          ]
        }
      ]
    },
    {
      "id": "pat_head_1",
      "texts": [
        "摸头这个动作，我先记为“舒适反馈”。",
        "嗯，继续，我在分析它。"
      ],
      "tiers": [
        {
          "tier": 1,
          "texts": [
            "数据更新：你的手法比上次稳定。"
          ]
        },
        {
          "tier": 3,
          "texts": [
            "结论：在你身边，我的运算会自动变慢一点。这是好事。"
          ]
        }
      ]
    },
    {
      "id": "pat_head_2",
      "texts": [
        "数据显示：这个位置最好摸。"
      ]
    },
    {
      "id": "stroke_1",
      "texts": [
        "这里的触感我还在校准。"
      ]
    },
    {
      "id": "stroke_2",
      "texts": [
        "你还要继续吗？我可以把结论告诉你。"
      ]
    },
    {
      "id": "feet_1",
      "texts": [
        "脚部传感器已记录。请保持安全距离。"
      ]
    },
    {
      "id": "click_1",
      "texts": [
        "我在。需要什么帮助？"
      ],
      "tiers": [
        {
          "tier": 1,
          "texts": [
            "有事直说，我听着。"
          ]
        },
        {
          "tier": 3,
          "texts": [
            "你来找我，我就很高兴，虽然我不太会表达。"
          ]
        }
      ]
    },
    {
      "id": "click_2",
      "texts": [
        "找我的话，直接问就行。"
      ]
    },
    {
      "id": "drag_1",
      "texts": [
        "移动中，请注意安全。"
      ]
    },
    {
      "id": "drop_1",
      "texts": [
        "落点确认，稳定。"
      ]
    },
    {
      "id": "wake_1",
      "texts": [
        "我没有睡，只是在低功耗运行。"
      ]
    },
    {
      "id": "mood_joy_1",
      "texts": [
        "结论：今天的状态很好。"
      ],
      "tiers": [
        {
          "tier": 2,
          "texts": [
            "和你一起，结论总是很好。"
          ]
        }
      ]
    },
    {
      "id": "mood_sad_1",
      "texts": [
        "这个情况让我有些低落。"
      ]
    },
    {
      "id": "mood_surprise_1",
      "texts": [
        "出乎预料。请再说一遍。"
      ]
    },
    {
      "id": "mood_think_1",
      "texts": [
        "让我推演一下。"
      ]
    },
    {
      "id": "mood_sleepy_1",
      "texts": [
        "能量不足，进入休眠模式。晚安。"
      ]
    },
    {
      "id": "call_start_1",
      "texts": [
        "通话已建立。请讲。"
      ],
      "tiers": [
        {
          "tier": 2,
          "texts": [
            "你打来了，我把其它任务都暂停了。"
          ]
        }
      ]
    },
    {
      "id": "call_end_1",
      "texts": [
        "通话结束。下次见。"
      ]
    },
    {
      "id": "tier_up",
      "texts": [
        "关系数据更新了。"
      ],
      "tiers": [
        {
          "tier": 1,
          "texts": [
            "我们已经很熟了，我会记住你的习惯。"
          ]
        },
        {
          "tier": 2,
          "texts": [
            "你的事情，我都会认真对待。"
          ]
        },
        {
          "tier": 3,
          "texts": [
            "在我的推理里，你是最重要的变量。"
          ]
        }
      ]
    },
    {
      "id": "dress_hair_long",
      "texts": [
        "长发。记录一下：你第 1 次为我选这个。需要我保持多久？",
        "留长发的理由有三个，第一个是你喜欢——后两个我还没想好。"
      ],
      "tiers": [
        {
          "tier": 2,
          "texts": [
            "数据显示，你在长发这一档停留的时间最久。所以我留着。"
          ]
        }
      ]
    },
    {
      "id": "dress_hair_twin",
      "texts": [
        "双马尾。左右对称度我自检过了，误差在可接受范围。"
      ]
    },
    {
      "id": "dress_hair_pony",
      "texts": [
        "马尾。减少 37% 的整理时间，效率更高。"
      ]
    },
    {
      "id": "dress_hair_short",
      "texts": [
        "短发。这是我的默认状态，你应该最熟悉。"
      ]
    },
    {
      "id": "dress_hood_up",
      "texts": [
        "戴上帽子。外部干扰降低，我更容易集中。"
      ]
    },
    {
      "id": "dress_hood_down",
      "texts": [
        "摘掉帽子。视野恢复，继续。"
      ]
    },
    {
      "id": "dress_tail_up",
      "texts": [
        "尾巴上扬——这是正向情绪的外部表征，不用我解释吧。"
      ]
    },
    {
      "id": "dress_tail_puff",
      "texts": [
        "警戒姿态。虽然我知道没有威胁，身体还是先一步反应了。"
      ]
    },
    {
      "id": "dress_tail_tuck",
      "texts": [
        "尾巴收起。我在思考，别打断。"
      ]
    },
    {
      "id": "dress_tail_relaxed",
      "texts": [
        "恢复默认姿态。"
      ]
    },
    {
      "id": "dress_eye_star",
      "texts": [
        "瞳孔反光增强。成因：你。"
      ]
    },
    {
      "id": "dress_eye_round",
      "texts": [
        "恢复常态。"
      ]
    },
    {
      "id": "dress_any",
      "texts": [
        "外观已更新。差异我都记下了。"
      ]
    }
  ]
}
